<?xml version="1.0" encoding="utf-8"?>
<statemachine
        xmlns:xsi="http://www.w3.org/2001/XMLSchema-instance"
        xsi:noNamespaceSchemaLocation="process.xsd">

    <process name="Invoice01" main="true">
        <states>
            <state name="new"/>
            <state name="invoice created"/>
            <state name="invoice creation failed"/>
            <state name="invoice sent" />
            <state name="order exported" />
            <state name="order exporting failed"/>
            <state name="order shipped" />
            <state name="waiting for payment" />
            <state name="payment received" />
            <state name="reminder I sent" />
            <state name="reminder II sent" />
            <state name="dunning process started" />
            <state name="ready for return" />
            <state name="completed" />
        </states>

        <transitions>
            <transition condition="Oms/IsInvoiceCreated">
                <source>new</source>
                <target>invoice created</target>
                <event>create invoice</event>
            </transition>
            <transition>
                <source>new</source>
                <target>invoice creation failed</target>
                <event>create invoice</event>
            </transition>

            <transition>
                <source>invoice created</source>
                <target>invoice sent</target>
                <event>send invoice</event>
            </transition>

            <transition condition="Oms/IsOrderExported">
                <source>invoice sent</source>
                <target>order exported</target>
                <event>export order</event>
            </transition>
            <transition>
                <source>invoice sent</source>
                <target>order exporting failed</target>
                <event>export order</event>
            </transition>

            <transition>
                <source>order exported</source>
                <target>order shipped</target>
                <event>ship order</event>
            </transition>

            <transition>
                <source>order shipped</source>
                <target>waiting for payment</target>
                <event>waiting for payment</event>
            </transition>

            <transition>
                <source>waiting for payment</source>
                <target>reminder I sent</target>
                <event>send reminder</event>
            </transition>

            <transition>
                <source>waiting for payment</source>
                <target>payment received</target>
                <event>confirm payment</event>
            </transition>

            <transition>
                <source>reminder I sent</source>
                <target>reminder II sent</target>
                <event>send reminder</event>
            </transition>

            <transition>
                <source>reminder I sent</source>
                <target>payment received</target>
                <event>confirm payment</event>
            </transition>

            <transition>
                <source>reminder II sent</source>
                <target>dunning process started</target>
                <event>send reminder</event>
            </transition>

            <transition>
                <source>reminder II sent</source>
                <target>payment received</target>
                <event>confirm payment</event>
            </transition>

            <transition>
                <source>dunning process started</source>
                <target>payment received</target>
                <event>confirm payment</event>
            </transition>

            <transition>
                <source>payment received</source>
                <target>ready for return</target>
                <event>ready for return</event>
            </transition>

            <transition>
                <source>ready for return</source>
                <target>completed</target>
                <event>complete order</event>
            </transition>

        </transitions>

        <events>
            <event name="create invoice" command="Oms/CreateInvoice" onEnter="true" />
            <event name="send invoice" command="Oms/SendInvoice" onEnter="true" />
            <event name="export order" command="Oms/ExportOrder" onEnter="true" />
            <event name="ship order" manual="true" />
            <event name="waiting for payment" onEnter="true" />
            <event name="send reminder" timeout="1hour" />
            <event name="confirm payment" manual="true" />
            <event name="ready for return"  onEnter="true" />
            <event name="complete order" timeout="14days" />
        </events>
    </process>

</statemachine>
