<?xml version="1.0" encoding="utf-8"?>
<statemachine
        xmlns:xsi="http://www.w3.org/2001/XMLSchema-instance"
        xsi:noNamespaceSchemaLocation="process.xsd"
>
    <process name="BraintreePayPal01" main="true">
        <subprocesses>
            <process>Capture</process>
            <process>Shipment</process>
            <process>Refund</process>
            <process>Closing</process>
        </subprocesses>

        <states>
            <state name="new" reserved="true"/>
            <state name="authorized" reserved="true"/>
            <state name="invalid"/>
            <state name="revert succeeded"/>
        </states>

        <transitions>
            <transition happy="true" condition="Braintree/IsAuthorizationApproved">
                <source>new</source>
                <target>authorized</target>
                <event>finalize authorization process</event>
            </transition>

            <transition>
                <source>new</source>
                <target>invalid</target>
                <event>finalize authorization process</event>
            </transition>

            <transition condition="Braintree/IsReversalApproved">
                <source>authorized</source>
                <target>revert succeeded</target>
                <event>revert payment</event>
            </transition>

            <transition happy="true">
                <source>authorized</source>
                <target>ready for capture</target>
                <event>start capture process</event>
            </transition>

            <transition happy="true">
                <source>capture succeeded</source>
                <target>ready for shipment</target>
                <event>start shipment process</event>
            </transition>

            <transition>
                <source>capture succeeded</source>
                <target>ready for refund</target>
                <event>start refund process</event>
            </transition>

            <transition happy="true">
                <source>shipped</source>
                <target>ready for closing</target>
                <event>start closing process with timeout</event>
            </transition>

            <transition>
                <source>refund succeeded</source>
                <target>ready for closing</target>
                <event>start closing process</event>
            </transition>
        </transitions>

        <events>
            <event name="finalize authorization process" onEnter="true" command="Braintree/Authorize"/>
            <event name="revert payment" manual="true" command="Braintree/Revert"/>
            <event name="start shipment process" manual="true"/>
            <event name="start capture process" onEnter="true"/>
            <event name="start refund process" manual="true"/>
            <event name="start closing process with timeout" timeout="14days"/>
            <event name="start closing process" onEnter="true"/>
        </events>
    </process>

    <process name="Shipment" file="BraintreeSubProcesses/Shipment.xml"/>
    <process name="Capture" file="BraintreeSubProcesses/Capture.xml"/>
    <process name="Refund" file="BraintreeSubProcesses/Refund.xml"/>
    <process name="Closing" file="BraintreeSubProcesses/Closing.xml"/>
</statemachine>
