<?xml version="1.0" encoding="utf-8"?>
<statemachine
        xmlns:xsi="http://www.w3.org/2001/XMLSchema-instance"
        xsi:noNamespaceSchemaLocation="process.xsd">
    <process name="CreditCard01" main="true">

        <subprocesses>
            <process>adyen capture</process>
            <process>export afterbuy</process>
        </subprocesses>

        <states>
            <state name="new"/>
            <state name="authorise request sent"/>
            <state name="authorise request success"/>
            <state name="authorise notification received"/>
            <state name="ready to send confirmation mail"/>
            <state name="invalid"/>
            <state name="paid"/>
        </states>

        <transitions>

            <transition happy="true">
                <source>new</source>
                <target>authorise request sent</target>
                <event>send authorise request</event>
            </transition>

            <transition happy="true" condition="Adyen/IsAuthoriseTransactionSuccess">
                <source>authorise request sent</source>
                <target>authorise request success</target>
                <event>adyen check authorise request</event>
            </transition>

            <transition>
                <source>authorise request sent</source>
                <target>invalid</target>
                <event>adyen check authorise request</event>
            </transition>

            <transition happy="true" condition="Adyen/IsAuthoriseNotificationSuccess">
                <source>authorise request success</source>
                <target>authorise notification received</target>
            </transition>

            <transition happy="true" condition="Adyen/IsAuthoriseNotificationSuccess">
                <source>authorise notification received</source>
                <target>ready to send confirmation mail</target>
                <event>adyen check authorise notification</event>
            </transition>

            <transition happy="true">
                <source>ready to send confirmation mail</source>
                <target>paid</target>
                <event>send order confirmation mail</event>
            </transition>

            <transition>
                <source>authorise notification received</source>
                <target>invalid</target>
                <event>adyen check authorise notification</event>
            </transition>

            <!-- SUBPROCESS CONNECTIONS -->

            <transition>
                <source>paid</source>
                <target>init capture process</target>
                <event>init capture</event>
            </transition>

            <transition>
                <source>captured</source>
                <target>init export to afterbuy</target>
                <event>init afterbuy export</event>
            </transition>

        </transitions>

        <events>
            <event name="send authorise request" onEnter="true" manual="true" command="Adyen/AuthoriseCreditCard"/>
            <event name="check authorise" onEnter="false" manual="true"/>
            <event name="adyen check authorise notification" onEnter="true"/>
            <event name="adyen check authorise request" onEnter="true" />
            <event name="send order confirmation mail" onEnter="true" command="TODO/DUMMY/DummySendOrderConfirmationMail"/>

            <!-- SUBPROCESS CONNECTIONS -->
            <event name="init capture" onEnter="true"/>
            <event name="init afterbuy export" onEnter="true"/>
        </events>

    </process>


    <process name="adyen capture" file="subprocesses/Capture01.xml"/>
    <process name="export afterbuy" file="subprocesses/ExportAfterBuy01.xml"/>


</statemachine>
