<?xml version="1.0" encoding="utf-8"?>
<statemachine
        xmlns:xsi="http://www.w3.org/2001/XMLSchema-instance"
        xsi:noNamespaceSchemaLocation="../process.xsd"
>
    <process name="Authorization">
        <states>
            <state name="ready for authorization"/>
            <state name="pre-authorization succeeded"/>
            <state name="authorization succeeded"/>
            <state name="invalid"/>
            <state name="authorization timed-out"/>
            <state name="re-authorization succeeded"/>
            <state name="re-authorization failed"/>
            <state name="revert succeeded"/>
        </states>

        <transitions>
            <!-- pre-authorization -->
            <transition happy="true" condition="Braintree/IsPreAuthorizationApproved">
                <source>ready for authorization</source>
                <target>pre-authorization succeeded</target>
                <event>pre-authorize payment</event>
            </transition>

            <transition>
                <source>ready for authorization</source>
                <target>invalid</target>
                <event>pre-authorize payment</event>
            </transition>

            <transition happy="true">
                <source>pre-authorization succeeded</source>
                <target>authorization succeeded</target>
                <event>authorize payment</event>
            </transition>

            <!-- re-authorization -->
            <transition happy="true" condition="Braintree/IsReAuthorizationApproved">
                <source>authorization succeeded</source>
                <target>re-authorization succeeded</target>
                <event>re-authorize payment</event>
            </transition>

            <transition>
                <source>authorization succeeded</source>
                <target>re-authorization failed</target>
                <event>re-authorize payment</event>
            </transition>

            <transition>
                <source>re-authorization succeeded</source>
                <target>authorization succeeded</target>
                <event>authorize payment</event>
            </transition>

            <transition>
                <source>re-authorization failed</source>
                <target>pre-authorization succeeded</target>
                <event>use previous pre-authorization</event>
            </transition>

            <!-- authorization timeout -->
            <transition>
                <source>authorization succeeded</source>
                <target>authorization timed-out</target>
                <event>timeout authorized payment</event>
            </transition>

            <transition happy="true" condition="Braintree/IsPreAuthorizationApproved">
                <source>authorization timed-out</source>
                <target>pre-authorization succeeded</target>
                <event>pre-authorize timed-out payment</event>
            </transition>

            <!-- reversal -->
            <transition happy="true" condition="Braintree/IsReversalApproved">
                <source>authorization succeeded</source>
                <target>revert succeeded</target>
                <event>revert payment</event>
            </transition>
        </transitions>

        <events>
            <event name="pre-authorize payment" onEnter="true" command="Braintree/PreAuthorize"/>
            <event name="re-authorize payment" manual="true" command="Braintree/ReAuthorize"/>
            <event name="authorize payment" onEnter="true"/>
            <event name="use previous pre-authorization" manual="true"/>
            <event name="timeout authorized payment" timeout="21days"/>
            <event name="pre-authorize timed-out payment" manual="true" command="Braintree/PreAuthorize"/>
            <event name="revert payment" manual="true" command="Braintree/Revert"/>
        </events>
    </process>
</statemachine>
